{
  "$schema": "./tokens.schema.json",
  "formatVersion": 1,
  "baseFontSize": 16,
  "description": "Canonical Tale UI design-token source. CSS custom properties and native token objects are generated from this file.",
  "files": {
    "_base.css": [
      {
        "selector": "html",
        "declarations": {
          "font-size": "100%"
        }
      },
      {
        "selector": ":root",
        "declarations": {
          "--background": "var(--neutral-5)",
          "--min-screen-width": "480px",
          "--max-screen-width": "1600px"
        }
      }
    ],
    "_spacing.css": [
      {
        "selector": ":root",
        "declarations": {
          "--space-4xs": "0.325rem",
          "--space-3xs": "0.4375rem",
          "--space-2xs": "0.61875rem",
          "--space-xs": "0.875rem",
          "--space-s": "1.2375rem",
          "--space-m": "1.75rem",
          "--space-l": "2.475rem",
          "--space-xl": "3.5rem",
          "--space-2xl": "4.95rem",
          "--space-3xl": "6.99375rem",
          "--space-4xl": "9.89375rem",
          "--section-space-xs": "2.475rem",
          "--section-space-s": "4.95rem",
          "--section-space-m": "6.99375rem",
          "--section-space-l": "9.89375rem",
          "--section-space-xl": "13.98125rem"
        }
      },
      {
        "selector": ".responsive",
        "declarations": {
          "--space-4xs": "clamp(0.325rem, calc(-0.03vw + 0.3375rem), 0.30625rem)",
          "--space-3xs": "clamp(0.4125rem, calc(0.04vw + 0.4rem), 0.4375rem)",
          "--space-2xs": "clamp(0.5125rem, calc(0.15vw + 0.46875rem), 0.61875rem)",
          "--space-xs": "clamp(0.6375rem, calc(0.34vw + 0.5375rem), 0.875rem)",
          "--space-s": "clamp(0.8rem, calc(0.63vw + 0.6125rem), 1.2375rem)",
          "--space-m": "clamp(1rem, calc(1.07vw + 0.68125rem), 1.75rem)",
          "--space-l": "clamp(1.25rem, calc(1.75vw + 0.725rem), 2.475rem)",
          "--space-xl": "clamp(1.5625rem, calc(2.77vw + 0.73125rem), 3.5rem)",
          "--space-2xl": "clamp(1.95625rem, calc(4.28vw + 0.66875rem), 4.95rem)",
          "--space-3xl": "clamp(2.44375rem, calc(6.51vw + 0.4875rem), 6.99375rem)",
          "--space-4xl": "clamp(3.05rem, calc(9.77vw + 0.11875rem), 9.89375rem)",
          "--section-space-xs": "clamp(1.25rem, calc(1.75vw + 0.725rem), 2.475rem)",
          "--section-space-s": "clamp(1.95625rem, calc(4.28vw + 0.66875rem), 4.95rem)",
          "--section-space-m": "clamp(2.44375rem, calc(6.51vw + 0.4875rem), 6.99375rem)",
          "--section-space-l": "clamp(3.05rem, calc(9.77vw + 0.11875rem), 9.89375rem)",
          "--section-space-xl": "clamp(3.8125rem, calc(14.29vw + -0.4625rem), 13.98125rem)"
        }
      }
    ],
    "_typography.css": [
      {
        "selector": ":root",
        "declarations": {
          "--text-xs": "0.76875rem",
          "--text-s": "0.83125rem",
          "--text-m": "1rem",
          "--text-l": "1.2rem",
          "--text-xl": "1.36875rem",
          "--text-2xl": "1.5375rem",
          "--text-3xl": "1.70625rem",
          "--text-4xl": "1.875rem",
          "--text-5xl": "2.125rem",
          "--text-6xl": "2.375rem",
          "--text-7xl": "2.5625rem",
          "--text-8xl": "2.8125rem",
          "--display-color": "var(--neutral-90)",
          "--text-color": "var(--neutral-90)",
          "--mono-color": "var(--neutral-90)",
          "--display-font": "\"Inter\", sans-serif",
          "--body-font": "\"Inter\", sans-serif",
          "--expressive-font": "\"Playfair Display\", serif",
          "--mono-font": "\"Roboto Mono\", monospace",
          "--display-font-family": "var(--display-font)",
          "--heading-font-family": "var(--display-font)",
          "--title-font-family": "var(--display-font)",
          "--label-font-family": "var(--body-font)",
          "--text-font-family": "var(--body-font)",
          "--mono-font-family": "var(--mono-font)",
          "--expressive-font-family": "var(--expressive-font)",
          "--display-l-font-size": "var(--text-7xl)",
          "--display-m-font-size": "var(--text-6xl)",
          "--display-s-font-size": "var(--text-5xl)",
          "--heading-l-font-size": "var(--text-4xl)",
          "--heading-m-font-size": "var(--text-3xl)",
          "--heading-s-font-size": "var(--text-2xl)",
          "--title-l-font-size": "calc(var(--text-xl) * 1.1)",
          "--title-m-font-size": "var(--text-xl)",
          "--title-s-font-size": "calc(var(--text-l) * 1.1)",
          "--label-l-font-size": "var(--text-l)",
          "--label-m-font-size": "var(--text-m)",
          "--label-s-font-size": "var(--text-s)",
          "--label-xs-font-size": "var(--text-xs)",
          "--text-l-font-size": "var(--text-l)",
          "--text-m-font-size": "var(--text-m)",
          "--text-s-font-size": "var(--text-s)",
          "--text-xs-font-size": "var(--text-xs)",
          "--mono-l-font-size": "var(--text-l)",
          "--mono-m-font-size": "var(--text-m)",
          "--mono-s-font-size": "var(--text-s)",
          "--mono-xs-font-size": "var(--text-xs)",
          "--display-font-weight": "600",
          "--heading-font-weight": "600",
          "--title-font-weight": "600",
          "--label-font-weight": "500",
          "--text-font-weight": "400",
          "--mono-font-weight": "400",
          "--display-line-height": "1.5",
          "--heading-line-height": "1.5",
          "--title-line-height": "1.5",
          "--label-line-height": "1.5",
          "--text-line-height": "1.5",
          "--mono-line-height": "1.5",
          "--display-letter-spacing": "normal",
          "--heading-letter-spacing": "normal",
          "--title-letter-spacing": "normal",
          "--label-letter-spacing": "normal",
          "--text-letter-spacing": "normal",
          "--mono-letter-spacing": "normal"
        }
      },
      {
        "selector": ".responsive",
        "declarations": {
          "--text-xs": "clamp(0.76875rem, calc(-0.11vw + 0.8rem), 0.69375rem)",
          "--text-s": "clamp(0.81875rem, calc(0.02vw + 0.8125rem), 0.83125rem)",
          "--text-m": "clamp(0.875rem, calc(0.18vw + 0.81875rem), 1rem)",
          "--text-l": "clamp(0.93125rem, calc(0.38vw + 0.81875rem), 1.2rem)",
          "--text-xl": "clamp(0.99375rem, calc(0.64vw + 0.73125rem), 1.36875rem)",
          "--text-2xl": "clamp(1.0625rem, calc(0.89vw + 0.65rem), 1.5375rem)",
          "--text-3xl": "clamp(1.13125rem, calc(1.15vw + 0.55625rem), 1.70625rem)",
          "--text-4xl": "clamp(1.51875rem, calc(1.40vw + 0.475rem), 1.875rem)",
          "--text-5xl": "clamp(1.61875rem, calc(2.05vw + 0.075rem), 2.125rem)",
          "--text-6xl": "clamp(1.71875rem, calc(2.70vw - 0.325rem), 2.375rem)",
          "--text-7xl": "clamp(1.8375rem, calc(3.35vw - 0.7875rem), 2.5625rem)",
          "--text-8xl": "clamp(1.9625rem, calc(4.00vw - 1.1875rem), 2.8125rem)"
        }
      }
    ],
    "_colors.css": [
      {
        "selector": ":root",
        "declarations": {
          "--primary": "var(--color-60)",
          "--red": "var(--red-60)",
          "--orange": "var(--orange-60)",
          "--amber": "var(--amber-60)",
          "--yellow": "var(--yellow-60)",
          "--lime": "var(--lime-60)",
          "--green": "var(--green-60)",
          "--emerald": "var(--emerald-60)",
          "--teal": "var(--teal-60)",
          "--cyan": "var(--cyan-60)",
          "--sky": "var(--sky-60)",
          "--indigo": "var(--indigo-60)",
          "--violet": "var(--violet-60)",
          "--purple": "var(--purple-60)",
          "--fuchsia": "var(--fuchsia-60)",
          "--pink": "var(--pink-60)",
          "--rose": "var(--rose-60)",
          "--error": "var(--error-60)",
          "--warning": "var(--warning-60)",
          "--success": "var(--success-60)",
          "--brand-5": "#e6f0f0",
          "--brand-10": "#cce1e1",
          "--brand-20": "#a4c7c9",
          "--brand-30": "#7badb1",
          "--brand-40": "#539198",
          "--brand-50": "#2b7580",
          "--brand-60": "#025768",
          "--brand-70": "#02485b",
          "--brand-80": "#023b4e",
          "--brand-90": "#012e41",
          "--brand-100": "#012334",
          "--red-5": "#fef6f6",
          "--red-10": "#fcecec",
          "--red-20": "#f6c4c4",
          "--red-30": "#ef9d9d",
          "--red-40": "#e97575",
          "--red-50": "#e24e4e",
          "--red-60": "#dc2626",
          "--red-70": "#c5171e",
          "--red-80": "#aa0b18",
          "--red-90": "#8c0213",
          "--red-100": "#66000f",
          "--orange-5": "#fff1e8",
          "--orange-10": "#fee3d0",
          "--orange-20": "#fdcdab",
          "--orange-30": "#fcb686",
          "--orange-40": "#fba061",
          "--orange-50": "#fa893b",
          "--orange-60": "#f97316",
          "--orange-70": "#d95707",
          "--orange-80": "#b33c00",
          "--orange-90": "#8c2600",
          "--orange-100": "#661300",
          "--amber-5": "#fcf4ea",
          "--amber-10": "#f9e8d5",
          "--amber-20": "#f4d6b4",
          "--amber-30": "#eec492",
          "--amber-40": "#e9b271",
          "--amber-50": "#e49f4f",
          "--amber-60": "#df8d2e",
          "--amber-70": "#cc7117",
          "--amber-80": "#b05506",
          "--amber-90": "#883a00",
          "--amber-100": "#612300",
          "--yellow-5": "#fffcf3",
          "--yellow-10": "#fef8e6",
          "--yellow-20": "#fcebb8",
          "--yellow-30": "#f9de8a",
          "--yellow-40": "#f5d05e",
          "--yellow-50": "#f0c233",
          "--yellow-60": "#eab308",
          "--yellow-70": "#c48d05",
          "--yellow-80": "#9d6b03",
          "--yellow-90": "#754b01",
          "--yellow-100": "#4d2e00",
          "--lime-5": "#f8faef",
          "--lime-10": "#f1f4de",
          "--lime-20": "#e0e9bb",
          "--lime-30": "#cdde99",
          "--lime-40": "#b7d376",
          "--lime-50": "#9fc754",
          "--lime-60": "#85bc31",